{
  "$schema": "./SMOKE_CONFIG_SCHEMA.json",
  "suiteName": "Family pension smoke",
  "defaultTargetEnv": "FAMILY_QUERY_SMOKE_TARGET",
  "defaultTargetFallback": "public",
  "urlEnvName": "FAMILY_QUERY_SMOKE_URL",
  "domainTerms": ["معاش", "تقاعد", "تعويض", "إعادة تخصيص"],
  "queryCases": [
    {
      "canonical": "معاش الابنة",
      "variants": ["معاش الابنة", "شو شروط معاش الابنة", "بدي اعرف عن معاش الابنة"]
    },
    {
      "canonical": "معاش الابنة الأرملة",
      "variants": ["معاش الابنة الأرملة", "طلب معاش الابنة الأرملة", "شو شروط معاش الابنة الأرملة"]
    },
    {
      "canonical": "معاش الابنة المطلقة",
      "variants": ["معاش الابنة المطلقة", "طلب معاش الابنة المطلقة", "شو شروط معاش الابنة المطلقة"]
    },
    {
      "canonical": "معاش الابن الذي يتابع الدراسة",
      "variants": ["معاش الابن الذي يتابع الدراسة", "شو شروط معاش الابن الذي يتابع الدراسة", "ابني يدرس هل بيطلعله معاش"]
    },
    {
      "canonical": "معاش الابن القاصر",
      "variants": ["معاش الابن القاصر", "طلب معاش الابن القاصر", "شو شروط معاش الابن القاصر"]
    },
    {
      "canonical": "معاش الزوجة",
      "variants": ["معاش الزوجة", "شو شروط معاش الزوجة", "بدي اعرف عن معاش الزوجة"]
    },
    {
      "canonical": "معاش الوالدة",
      "variants": ["معاش الوالدة", "شو شروط معاش الوالدة", "بدي اعرف عن معاش الوالدة"]
    }
  ]
}